{
  "id": "eos.artifact.padel-iot.mobile-control-plan",
  "type": "mobile_plan",
  "title": "Mobile remote control plan (gap-aware)",
  "project_id": "eos.project.padel-iot",
  "status": "planned",
  "version": "0.1.0",
  "origin": {
    "kind": "agency_scenario",
    "project": "padel-iot"
  },
  "depends_on_artifacts": [
    "eos.artifact.padel-iot.connectivity-plan"
  ]
}
