{
  "id": "eos.artifact.padel-iot.observability-plan",
  "type": "observability_plan",
  "title": "Device and cloud observability plan",
  "project_id": "eos.project.padel-iot",
  "status": "planned",
  "version": "0.1.0",
  "origin": {
    "kind": "agency_scenario",
    "project": "padel-iot"
  },
  "depends_on_artifacts": [
    "eos.artifact.padel-iot.system-architecture"
  ]
}
